{
  "id": "executive-clean",
  "name": "Executive Clean",
  "purpose": "Management reviews, strategy and decision decks",
  "canvas": "wide",
  "background": "FFFFFF",
  "font": {
    "latin": "Noto Sans",
    "cjk": "Noto Sans CJK SC",
    "title_size": 28,
    "body_size": 18
  },
  "colors": {
    "text": "202124",
    "muted": "526373",
    "accent": "176B87",
    "accent_soft": "EAF3F7",
    "panel": "F5F7FA",
    "line": "D5E0E6"
  },
  "style": {
    "density": "medium-high",
    "margin_x": 0.78,
    "title_rule": "accent",
    "table_header": "soft",
    "table_banding": false,
    "metric_style": "open",
    "chart_grid": "light",
    "cover_treatment": "editorial",
    "table_size": 14,
    "chart_size": 12
  }
}
