{
  "id": "consulting",
  "name": "Consulting Structured",
  "purpose": "Issue-led strategy and problem-solving decks",
  "canvas": "wide",
  "background": "FFFFFF",
  "font": {
    "latin": "Noto Sans",
    "cjk": "Noto Sans CJK SC",
    "title_size": 26,
    "body_size": 17
  },
  "colors": {
    "text": "111827",
    "muted": "526373",
    "accent": "176B87",
    "accent_soft": "EAF3F7",
    "panel": "F8FAFC",
    "line": "D5E0E6"
  },
  "style": {
    "density": "high",
    "margin_x": 0.65,
    "title_rule": "accent",
    "table_header": "solid",
    "table_banding": false,
    "metric_style": "open",
    "chart_grid": "none",
    "cover_treatment": "editorial",
    "table_size": 14,
    "chart_size": 12
  }
}
