{
  "id": "executive-dense",
  "name": "Executive Dense",
  "purpose": "High-density operating reviews and leadership reports",
  "canvas": "wide",
  "background": "FFFFFF",
  "font": {
    "latin": "Noto Sans",
    "cjk": "Noto Sans CJK SC",
    "title_size": 26,
    "body_size": 17
  },
  "colors": {
    "text": "1F2328",
    "muted": "526373",
    "accent": "176B87",
    "accent_soft": "EAF3F7",
    "panel": "F7F8FA",
    "line": "D5E0E6"
  },
  "style": {
    "density": "high",
    "margin_x": 0.65,
    "title_rule": "line",
    "table_header": "solid",
    "table_banding": false,
    "metric_style": "open",
    "chart_grid": "light",
    "cover_treatment": "band",
    "table_size": 14,
    "chart_size": 12,
    "image_gap": 0.35,
    "image_caption_size": 11,
    "image_border": "none"
  }
}
