{
  "id": "launch",
  "name": "Launch Premium",
  "purpose": "Product launch and executive storytelling",
  "canvas": "wide",
  "background": "FFFFFF",
  "font": {
    "latin": "Noto Sans",
    "cjk": "Noto Sans CJK SC",
    "title_size": 32,
    "body_size": 21
  },
  "colors": {
    "text": "18181B",
    "muted": "71717A",
    "accent": "B42318",
    "accent_soft": "FEF3F2",
    "panel": "FAFAFA",
    "line": "E4E4E7"
  },
  "style": {
    "density": "medium-low",
    "margin_x": 0.85,
    "title_rule": "none",
    "table_header": "soft",
    "table_banding": false,
    "metric_style": "open",
    "chart_grid": "none",
    "cover_treatment": "band",
    "table_size": 16,
    "chart_size": 14
  }
}
