{
  "id": "dark-executive",
  "name": "Dark Executive",
  "purpose": "Selective high-impact executive or keynote pages",
  "canvas": "wide",
  "background": "111827",
  "font": {
    "latin": "Noto Sans",
    "cjk": "Noto Sans CJK SC",
    "title_size": 29,
    "body_size": 19
  },
  "colors": {
    "text": "F9FAFB",
    "muted": "9CA3AF",
    "accent": "60A5FA",
    "accent_soft": "172554",
    "panel": "1F2937",
    "line": "374151"
  },
  "style": {
    "density": "medium-low",
    "margin_x": 0.85,
    "title_rule": "accent",
    "table_header": "soft",
    "table_banding": true,
    "metric_style": "open",
    "chart_grid": "none",
    "cover_treatment": "band",
    "table_size": 16,
    "chart_size": 14,
    "image_gap": 0.5,
    "image_caption_size": 11,
    "image_border": "none"
  }
}
